{
  "name": "Hexis Wallet: Polygon",
  "logoURI": "https://raw.githubusercontent.com/fbsobreira/wallet-data/main/chains/polygon/info/logo.png",
  "timestamp": "2026-01-05T19:12:23Z",
  "version": {
    "major": 1,
    "minor": 0,
    "patch": 0
  },
  "keywords": [
    "hexis",
    "hexis-wallet:-polygon"
  ],
  "tokens": [
    {
      "chainId": 137,
      "address": "0x0d500B1d8E8eF31E21C99d1Db9A6444d3ADf1270",
      "name": "Wrapped MATIC",
      "symbol": "WMATIC",
      "decimals": 18,
      "logoURI": "https://raw.githubusercontent.com/fbsobreira/wallet-data/main/chains/polygon/assets/0x0d500B1d8E8eF31E21C99d1Db9A6444d3ADf1270/logo.png",
      "tags": [
        "wrapped",
        "defi"
      ],
      "extensions": {
        "website": "https://polygon.technology",
        "coingeckoId": "wmatic"
      }
    },
    {
      "chainId": 137,
      "address": "0x3c499c542cEF5E3811e1192ce70d8cC03d5c3359",
      "name": "USD Coin",
      "symbol": "USDC",
      "decimals": 6,
      "logoURI": "https://raw.githubusercontent.com/fbsobreira/wallet-data/main/chains/polygon/assets/0x3c499c542cEF5E3811e1192ce70d8cC03d5c3359/logo.png",
      "tags": [
        "stablecoin",
        "defi"
      ],
      "extensions": {
        "website": "https://www.circle.com/usdc",
        "coingeckoId": "usd-coin"
      }
    },
    {
      "chainId": 137,
      "address": "0x7ceB23fD6bC0adD59E62ac25578270cFf1b9f619",
      "name": "Wrapped Ether",
      "symbol": "WETH",
      "decimals": 18,
      "logoURI": "https://raw.githubusercontent.com/fbsobreira/wallet-data/main/chains/polygon/assets/0x7ceB23fD6bC0adD59E62ac25578270cFf1b9f619/logo.png",
      "tags": [
        "wrapped",
        "defi"
      ],
      "extensions": {
        "website": "https://weth.io",
        "coingeckoId": "weth"
      }
    },
    {
      "chainId": 137,
      "address": "0xc2132D05D31c914a87C6611C10748AEb04B58e8F",
      "name": "Tether USD",
      "symbol": "USDT",
      "decimals": 6,
      "logoURI": "https://raw.githubusercontent.com/fbsobreira/wallet-data/main/chains/polygon/assets/0xc2132D05D31c914a87C6611C10748AEb04B58e8F/logo.png",
      "tags": [
        "stablecoin",
        "defi"
      ],
      "extensions": {
        "website": "https://tether.to",
        "coingeckoId": "tether"
      }
    }
  ]
}
