{
  "name": "Hexis Wallet: Ethereum",
  "logoURI": "https://raw.githubusercontent.com/fbsobreira/wallet-data/main/chains/ethereum/info/logo.png",
  "timestamp": "2026-01-05T19:12:23Z",
  "version": {
    "major": 1,
    "minor": 0,
    "patch": 0
  },
  "keywords": [
    "hexis",
    "hexis-wallet:-ethereum"
  ],
  "tokens": [
    {
      "chainId": 1,
      "address": "0x0000000000085d4780B73119b644AE5ecd22b376",
      "name": "TrueUSD",
      "symbol": "TUSD",
      "decimals": 18,
      "logoURI": "https://raw.githubusercontent.com/fbsobreira/wallet-data/main/chains/ethereum/assets/0x0000000000085d4780B73119b644AE5ecd22b376/logo.png",
      "tags": [
        "stablecoin"
      ],
      "extensions": {
        "website": "https://tusd.io/",
        "coingeckoId": "true-usd"
      }
    },
    {
      "chainId": 1,
      "address": "0x1f9840a85d5aF5bf1D1762F925BDADdC4201F984",
      "name": "Uniswap",
      "symbol": "UNI",
      "decimals": 18,
      "logoURI": "https://raw.githubusercontent.com/fbsobreira/wallet-data/main/chains/ethereum/assets/0x1f9840a85d5aF5bf1D1762F925BDADdC4201F984/logo.png",
      "tags": [
        "governance",
        "defi",
        "dex"
      ],
      "extensions": {
        "website": "https://uniswap.org",
        "coingeckoId": "uniswap"
      }
    },
    {
      "chainId": 1,
      "address": "0x2260FAC5E5542a773Aa44fBCfeDf7C193bc2C599",
      "name": "Wrapped BTC",
      "symbol": "WBTC",
      "decimals": 8,
      "logoURI": "https://raw.githubusercontent.com/fbsobreira/wallet-data/main/chains/ethereum/assets/0x2260FAC5E5542a773Aa44fBCfeDf7C193bc2C599/logo.png",
      "tags": [
        "wrapped",
        "defi"
      ],
      "extensions": {
        "website": "https://wbtc.network",
        "coingeckoId": "wrapped-bitcoin"
      }
    },
    {
      "chainId": 1,
      "address": "0x4f8e5De400dE08b164e7421b3eE387f461bECD1a",
      "name": "USDD",
      "symbol": "USDD",
      "decimals": 18,
      "logoURI": "https://raw.githubusercontent.com/fbsobreira/wallet-data/main/chains/ethereum/assets/0x4f8e5De400dE08b164e7421b3eE387f461bECD1a/logo.png",
      "tags": [
        "stablecoin",
        "defi"
      ],
      "extensions": {
        "website": "https://usdd.io/",
        "coingeckoId": "usdd"
      }
    },
    {
      "chainId": 1,
      "address": "0x514910771AF9Ca656af840dff83E8264EcF986CA",
      "name": "Chainlink",
      "symbol": "LINK",
      "decimals": 18,
      "logoURI": "https://raw.githubusercontent.com/fbsobreira/wallet-data/main/chains/ethereum/assets/0x514910771AF9Ca656af840dff83E8264EcF986CA/logo.png",
      "tags": [
        "oracle",
        "defi",
        "utility"
      ],
      "extensions": {
        "website": "https://chain.link",
        "coingeckoId": "chainlink"
      }
    },
    {
      "chainId": 1,
      "address": "0x54D2252757e1672EEaD234D27B1270728fF90581",
      "name": "Bitget Token",
      "symbol": "BGB",
      "decimals": 18,
      "logoURI": "https://raw.githubusercontent.com/fbsobreira/wallet-data/main/chains/ethereum/assets/0x54D2252757e1672EEaD234D27B1270728fF90581/logo.png",
      "tags": [
        "exchange",
        "utility"
      ],
      "extensions": {
        "website": "https://www.bitget.com",
        "coingeckoId": "bitget-token"
      }
    },
    {
      "chainId": 1,
      "address": "0x57B946008913B82E4dF85f501cbAeD910e58D26C",
      "name": "Marlin",
      "symbol": "POND",
      "decimals": 18,
      "logoURI": "https://raw.githubusercontent.com/fbsobreira/wallet-data/main/chains/ethereum/assets/0x57B946008913B82E4dF85f501cbAeD910e58D26C/logo.png",
      "tags": [
        "infrastructure",
        "defi",
        "layer2"
      ],
      "extensions": {
        "website": "https://www.marlin.org/",
        "coingeckoId": "marlin"
      }
    },
    {
      "chainId": 1,
      "address": "0x6982508145454Ce325dDbE47a25d4ec3d2311933",
      "name": "Pepe",
      "symbol": "PEPE",
      "decimals": 18,
      "logoURI": "https://raw.githubusercontent.com/fbsobreira/wallet-data/main/chains/ethereum/assets/0x6982508145454Ce325dDbE47a25d4ec3d2311933/logo.png",
      "tags": [
        "meme",
        "community"
      ],
      "extensions": {
        "website": "https://www.pepe.vip/",
        "coingeckoId": "pepe"
      }
    },
    {
      "chainId": 1,
      "address": "0x6B175474E89094C44Da98b954EedeAC495271d0F",
      "name": "Dai Stablecoin",
      "symbol": "DAI",
      "decimals": 18,
      "logoURI": "https://raw.githubusercontent.com/fbsobreira/wallet-data/main/chains/ethereum/assets/0x6B175474E89094C44Da98b954EedeAC495271d0F/logo.png",
      "tags": [
        "stablecoin",
        "defi"
      ],
      "extensions": {
        "website": "https://makerdao.com",
        "coingeckoId": "dai"
      }
    },
    {
      "chainId": 1,
      "address": "0x6c3ea9036406852006290770BEDFcAbA0e23A0e8",
      "name": "PayPal USD",
      "symbol": "PYUSD",
      "decimals": 6,
      "logoURI": "https://raw.githubusercontent.com/fbsobreira/wallet-data/main/chains/ethereum/assets/0x6c3ea9036406852006290770BEDFcAbA0e23A0e8/logo.png",
      "tags": [
        "stablecoin",
        "payments"
      ],
      "extensions": {
        "website": "https://www.paypal.com/us/digital-wallet/manage-money/crypto/pyusd",
        "coingeckoId": "paypal-usd"
      }
    },
    {
      "chainId": 1,
      "address": "0x75231F58b43240C9718Dd58B4967c5114342a86c",
      "name": "OKB",
      "symbol": "OKB",
      "decimals": 18,
      "logoURI": "https://raw.githubusercontent.com/fbsobreira/wallet-data/main/chains/ethereum/assets/0x75231F58b43240C9718Dd58B4967c5114342a86c/logo.png",
      "tags": [
        "exchange",
        "utility"
      ],
      "extensions": {
        "website": "https://www.okx.com/okb",
        "coingeckoId": "okb"
      }
    },
    {
      "chainId": 1,
      "address": "0xA0b86991c6218b36c1d19D4a2e9Eb0cE3606eB48",
      "name": "USD Coin",
      "symbol": "USDC",
      "decimals": 6,
      "logoURI": "https://raw.githubusercontent.com/fbsobreira/wallet-data/main/chains/ethereum/assets/0xA0b86991c6218b36c1d19D4a2e9Eb0cE3606eB48/logo.png",
      "tags": [
        "stablecoin",
        "defi"
      ],
      "extensions": {
        "website": "https://www.circle.com/usdc",
        "coingeckoId": "usd-coin"
      }
    },
    {
      "chainId": 1,
      "address": "0xA6c0c097741d55Ecd9a3a7DEf3a8253fD022cEb9",
      "name": "Travala",
      "symbol": "AVA",
      "decimals": 18,
      "logoURI": "https://raw.githubusercontent.com/fbsobreira/wallet-data/main/chains/ethereum/assets/0xA6c0c097741d55Ecd9a3a7DEf3a8253fD022cEb9/logo.png",
      "tags": [
        "travel",
        "loyalty",
        "utility"
      ],
      "extensions": {
        "website": "https://www.travala.com",
        "coingeckoId": "ava"
      }
    },
    {
      "chainId": 1,
      "address": "0xC02aaA39b223FE8D0A0e5C4F27eAD9083C756Cc2",
      "name": "Wrapped Ether",
      "symbol": "WETH",
      "decimals": 18,
      "logoURI": "https://raw.githubusercontent.com/fbsobreira/wallet-data/main/chains/ethereum/assets/0xC02aaA39b223FE8D0A0e5C4F27eAD9083C756Cc2/logo.png",
      "tags": [
        "wrapped",
        "defi"
      ],
      "extensions": {
        "website": "https://weth.io",
        "coingeckoId": "weth"
      }
    },
    {
      "chainId": 1,
      "address": "0xC669928185DbCE49d2230CC9B0979BE6DC797957",
      "name": "BitTorrent",
      "symbol": "BTT",
      "decimals": 18,
      "logoURI": "https://raw.githubusercontent.com/fbsobreira/wallet-data/main/chains/ethereum/assets/0xC669928185DbCE49d2230CC9B0979BE6DC797957/logo.png",
      "tags": [
        "storage",
        "utility",
        "infrastructure"
      ],
      "extensions": {
        "website": "https://www.bittorrent.com/btt/",
        "coingeckoId": "bittorrent"
      }
    },
    {
      "chainId": 1,
      "address": "0xdAC17F958D2ee523a2206206994597C13D831ec7",
      "name": "Tether USD",
      "symbol": "USDT",
      "decimals": 6,
      "logoURI": "https://raw.githubusercontent.com/fbsobreira/wallet-data/main/chains/ethereum/assets/0xdAC17F958D2ee523a2206206994597C13D831ec7/logo.png",
      "tags": [
        "stablecoin",
        "defi"
      ],
      "extensions": {
        "website": "https://tether.to",
        "coingeckoId": "tether"
      }
    }
  ]
}
